{
  "exportVersion": "1.0.0",
  "schemaVersion": "1.0.0",
  "kind": "public-content",
  "createdAt": "2026-10-13T00:00:00.000Z",
  "files": [
    {
      "path": "content/site.json",
      "byteSize": 471
    },
    {
      "path": "content/projects.json",
      "byteSize": 2
    },
    {
      "path": "content/assets.json",
      "byteSize": 2
    }
  ]
}